QA output created by 1592
QA output created by 1591 --valgrind

=== V2 ===
=== std out ===
Expect timestamps to start @14:49:48.067305985
sampledso.long.one -> 30.0.10
sampledso.ulonglong.ten -> 30.0.99
sampledso.float.hundred -> 30.0.17
sampledso.double.million -> 30.0.28
sampledso.string.hullo -> 30.0.31
sampledso.bin -> 30.0.6
__pmLogPutResult2: 1 metrics @14:49:49.067305985 ...
__pmLogPutResult2: 2 metrics @14:49:50.067305985 ...
__pmLogPutResult2: 3 metrics @14:49:51.067305985 ...
__pmLogPutResult2: 4 metrics @14:49:52.067305985 ...
__pmLogPutResult2: 5 metrics @14:49:53.067305985 ...
__pmLogPutResult2: 6 metrics @14:49:54.067305985 ...
pmaPutMark: @14:49:54.567305985
pmaPutMark: @14:49:55.067305985
=== filtered valgrind report ===
Memcheck, a memory error detector
Command: src/chklogputresult -V 2 -m -m TMP_v2
LEAK SUMMARY:
definitely lost: 0 bytes in 0 blocks
indirectly lost: 0 bytes in 0 blocks
ERROR SUMMARY: 0 errors from 0 contexts ...
=== std out ===
pmGetArchiveEnd time: 14:49:55.067305000
=== filtered valgrind report ===
Memcheck, a memory error detector
Command: src/archend TMP_v2
LEAK SUMMARY:
definitely lost: 0 bytes in 0 blocks
indirectly lost: 0 bytes in 0 blocks
ERROR SUMMARY: 0 errors from 0 contexts ...
=== std out ===
[0] len=132 magic=0x50052602 (version=2) @ offset=0
[1] len=40 @ offset=132
Timestamp: 14:49:49.067305000 numpmid: 1
  <0> 30.0.10 numval: 1 valfmt: 0
    inst[-1]: 1 1.4012985e-45 0x1
[2] len=72 @ offset=172
Timestamp: 14:49:50.067305000 numpmid: 2
  <0> 30.0.10 numval: 1 valfmt: 0
    inst[-1]: 1 1.4012985e-45 0x1
  <1> 30.0.99 numval: 1 valfmt: 1
    inst[-1]: 10
[3] len=100 @ offset=244
Timestamp: 14:49:51.067305000 numpmid: 3
  <0> 30.0.10 numval: 1 valfmt: 0
    inst[-1]: 1 1.4012985e-45 0x1
  <1> 30.0.99 numval: 1 valfmt: 1
    inst[-1]: 10
  <2> 30.0.17 numval: 1 valfmt: 1
    inst[-1]: 100
[4] len=132 @ offset=344
Timestamp: 14:49:52.067305000 numpmid: 4
  <0> 30.0.10 numval: 1 valfmt: 0
    inst[-1]: 1 1.4012985e-45 0x1
  <1> 30.0.99 numval: 1 valfmt: 1
    inst[-1]: 10
  <2> 30.0.17 numval: 1 valfmt: 1
    inst[-1]: 100
  <3> 30.0.28 numval: 1 valfmt: 1
    inst[-1]: 1000000
[5] len=172 @ offset=476
Timestamp: 14:49:53.067305000 numpmid: 5
  <0> 30.0.10 numval: 1 valfmt: 0
    inst[-1]: 1 1.4012985e-45 0x1
  <1> 30.0.99 numval: 1 valfmt: 1
    inst[-1]: 10
  <2> 30.0.17 numval: 1 valfmt: 1
    inst[-1]: 100
  <3> 30.0.28 numval: 1 valfmt: 1
    inst[-1]: 1000000
  <4> 30.0.31 numval: 1 valfmt: 1
    inst[-1]: "hullo world!"
[6] len=256 @ offset=648
Timestamp: 14:49:54.067305000 numpmid: 6
  <0> 30.0.10 numval: 1 valfmt: 0
    inst[-1]: 1 1.4012985e-45 0x1
  <1> 30.0.99 numval: 1 valfmt: 1
    inst[-1]: 10
  <2> 30.0.17 numval: 1 valfmt: 1
    inst[-1]: 100
  <3> 30.0.28 numval: 1 valfmt: 1
    inst[-1]: 1000000
  <4> 30.0.31 numval: 1 valfmt: 1
    inst[-1]: "hullo world!"
  <5> 30.0.6 numval: 9 valfmt: 0
    inst[100]: 100 1.4012985e-43 0x64
    inst[200]: 200 2.8025969e-43 0xc8
    inst[300]: 300 4.2038954e-43 0x12c
    inst[400]: 400 5.6051939e-43 0x190
    inst[500]: 500 7.0064923e-43 0x1f4
    inst[600]: 600 8.4077908e-43 0x258
    inst[700]: 700 9.8090893e-43 0x2bc
    inst[800]: 800 1.1210388e-42 0x320
    inst[900]: 900 1.2611686e-42 0x384
[7] len=20 @ offset=904
Timestamp: 14:49:54.567305000 numpmid: 0 <mark>
[8] len=20 @ offset=924
Timestamp: 14:49:55.067305000 numpmid: 0 <mark>
9 data records found
=== filtered valgrind report ===
Memcheck, a memory error detector
Command: src/scandata -o -v TMP_v2.0
LEAK SUMMARY:
definitely lost: 0 bytes in 0 blocks
indirectly lost: 0 bytes in 0 blocks
ERROR SUMMARY: 0 errors from 0 contexts ...

=== V3 ===
=== std out ===
Expect timestamps to start @14:49:48.067305985
sampledso.long.one -> 30.0.10
sampledso.ulonglong.ten -> 30.0.99
sampledso.float.hundred -> 30.0.17
sampledso.double.million -> 30.0.28
sampledso.string.hullo -> 30.0.31
sampledso.bin -> 30.0.6
__pmLogPutResult3: 1 metrics @14:49:49.067305985 ...
__pmLogPutResult3: 2 metrics @14:49:50.067305985 ...
__pmLogPutResult3: 3 metrics @14:49:51.067305985 ...
__pmLogPutResult3: 4 metrics @14:49:52.067305985 ...
__pmLogPutResult3: 5 metrics @14:49:53.067305985 ...
__pmLogPutResult3: 6 metrics @14:49:54.067305985 ...
pmaPutMark: @14:49:54.567305985
pmaPutMark: @14:49:55.067305985
=== filtered valgrind report ===
Memcheck, a memory error detector
Command: src/chklogputresult -V 3 -m -m TMP_v3
LEAK SUMMARY:
definitely lost: 0 bytes in 0 blocks
indirectly lost: 0 bytes in 0 blocks
ERROR SUMMARY: 0 errors from 0 contexts ...
=== std out ===
pmGetArchiveEnd time: 14:49:55.067305985
=== filtered valgrind report ===
Memcheck, a memory error detector
Command: src/archend TMP_v3
LEAK SUMMARY:
definitely lost: 0 bytes in 0 blocks
indirectly lost: 0 bytes in 0 blocks
ERROR SUMMARY: 0 errors from 0 contexts ...
=== std out ===
[0] len=808 magic=0x50052603 (version=3) @ offset=0
[1] len=44 @ offset=808
Timestamp: 14:49:49.067305985
 numpmid: 1
  <0> 30.0.10 numval: 1 valfmt: 0
    inst[-1]: 1 1.4012985e-45 0x1
[2] len=76 @ offset=852
Timestamp: 14:49:50.067305985
 numpmid: 2
  <0> 30.0.10 numval: 1 valfmt: 0
    inst[-1]: 1 1.4012985e-45 0x1
  <1> 30.0.99 numval: 1 valfmt: 1
    inst[-1]: 10
[3] len=104 @ offset=928
Timestamp: 14:49:51.067305985
 numpmid: 3
  <0> 30.0.10 numval: 1 valfmt: 0
    inst[-1]: 1 1.4012985e-45 0x1
  <1> 30.0.99 numval: 1 valfmt: 1
    inst[-1]: 10
  <2> 30.0.17 numval: 1 valfmt: 1
    inst[-1]: 100
[4] len=136 @ offset=1032
Timestamp: 14:49:52.067305985
 numpmid: 4
  <0> 30.0.10 numval: 1 valfmt: 0
    inst[-1]: 1 1.4012985e-45 0x1
  <1> 30.0.99 numval: 1 valfmt: 1
    inst[-1]: 10
  <2> 30.0.17 numval: 1 valfmt: 1
    inst[-1]: 100
  <3> 30.0.28 numval: 1 valfmt: 1
    inst[-1]: 1000000
[5] len=176 @ offset=1168
Timestamp: 14:49:53.067305985
 numpmid: 5
  <0> 30.0.10 numval: 1 valfmt: 0
    inst[-1]: 1 1.4012985e-45 0x1
  <1> 30.0.99 numval: 1 valfmt: 1
    inst[-1]: 10
  <2> 30.0.17 numval: 1 valfmt: 1
    inst[-1]: 100
  <3> 30.0.28 numval: 1 valfmt: 1
    inst[-1]: 1000000
  <4> 30.0.31 numval: 1 valfmt: 1
    inst[-1]: "hullo world!"
[6] len=260 @ offset=1344
Timestamp: 14:49:54.067305985
 numpmid: 6
  <0> 30.0.10 numval: 1 valfmt: 0
    inst[-1]: 1 1.4012985e-45 0x1
  <1> 30.0.99 numval: 1 valfmt: 1
    inst[-1]: 10
  <2> 30.0.17 numval: 1 valfmt: 1
    inst[-1]: 100
  <3> 30.0.28 numval: 1 valfmt: 1
    inst[-1]: 1000000
  <4> 30.0.31 numval: 1 valfmt: 1
    inst[-1]: "hullo world!"
  <5> 30.0.6 numval: 9 valfmt: 0
    inst[100]: 100 1.4012985e-43 0x64
    inst[200]: 200 2.8025969e-43 0xc8
    inst[300]: 300 4.2038954e-43 0x12c
    inst[400]: 400 5.6051939e-43 0x190
    inst[500]: 500 7.0064923e-43 0x1f4
    inst[600]: 600 8.4077908e-43 0x258
    inst[700]: 700 9.8090893e-43 0x2bc
    inst[800]: 800 1.1210388e-42 0x320
    inst[900]: 900 1.2611686e-42 0x384
[7] len=24 @ offset=1604
Timestamp: 14:49:54.567305985
 numpmid: 0 <mark>
[8] len=24 @ offset=1628
Timestamp: 14:49:55.067305985
 numpmid: 0 <mark>
9 data records found
=== filtered valgrind report ===
Memcheck, a memory error detector
Command: src/scandata -o -v TMP_v3.0
LEAK SUMMARY:
definitely lost: 0 bytes in 0 blocks
indirectly lost: 0 bytes in 0 blocks
ERROR SUMMARY: 0 errors from 0 contexts ...
